Measure,Count,Reporting,Missing
Residents.Confirmed,411152,53,""
Staff.Confirmed,114049,49,"Arkansas, Mississippi, Nebraska, ICE"
Residents.Deaths,2711,53,""
Staff.Deaths,195,43,"Arizona, Massachusetts, Mississippi, Nebraska, New Jersey
 Oklahoma, Pennsylvania, Utah, Wisconsin, ICE"
Residents.Tadmin,4502720,40,"Arizona, Arkansas, California, Florida, Georgia
 Kansas, Kentucky, Montana, Nevada, Rhode Island
 Washington, Federal, District of Columbia"
Residents.Initiated,402901,28,"Arizona, Arkansas, Florida, Hawaii, Illinois
 Indiana, Iowa, Kentucky, Louisiana, Mississippi
 Montana, Nebraska, Nevada, New Mexico, New York
 Oklahoma, Oregon, Rhode Island, South Dakota, Texas
 Utah, Vermont, Wyoming, ICE, District of Columbia"
Staff.Initiated,111208,19,"Alaska, Arizona, Arkansas, Florida, Hawaii
 Idaho, Illinois, Indiana, Iowa, Kentucky
 Louisiana, Maine, Michigan, Mississippi, Missouri
 Montana, Nebraska, Nevada, New Hampshire, New Mexico
 New York, North Dakota, Oklahoma, Oregon, Rhode Island
 South Carolina, South Dakota, Texas, Utah, Vermont
 Wisconsin, Wyoming, ICE, District of Columbia"
